Name,Slug,Description,Status,ImageCover,Products
Bushmills Distillery,Bushmills,"Granted a license to distil in 1608, Bushmills is the oldest licensed whiskey distillery in the world.\n\nOver 400 years later, whiskey is still being made in Bushmills, thanks to experience and craft passed down from generation to generation.",,https://arweave.net/LkHJLOe9sTHKjS3CXK5k2swrih1P-T2vxqV2yXWWodA,
GinT Distillery,GinT,"Inaugurated in 2017, GinT Distillery has been at the forefront of artisanal spirit creation, meticulously crafting each batch with unparalleled dedication. Our distillery has produced over 30 distinctive gins, each boasting its singular character. Over the years, we have delved into the realm of aged gins, releasing limited editions that have captivated connoisseurs with their exceptional Flavors and aromas. This journey has endowed us with a deep understanding of the nuances of spirit maturation.\nEmbarking on a new venture, we are exploring the aging of grain distillates. After a three-year maturation period in oak casks, this distillate will earn the esteemed title of whisky. ",,https://arweave.net/MfgwfTjD3CPDORKs_gOrkvQnsKPAX1loapL9iSOv7zk,Missing Link Lucy Cask
James Martin,James Martin,"James Martin, known as ‘Sparry’ to his acquaintances because of his prowess in the boxing ring, set up in business as a whisky merchant in Edinburgh during 1878. He had previously worked as a travelling salesman for Leith whisky merchant John H Bartram.\n\nMartin developed lucrative export markets for his whiskies, and this area of activity gained greater importance when the firm was being run by his partner, Edward Macdonald, whose brother Daniel joined him in the firm after Martin’s death in 1899. Indeed, from 1933, Martin’s blends were among the top 10 premium brands in the US. The brands in question included James Martin’s VVO Gold Bar 8-year-old, James Martin’s De Luxe 12-year-old, James Martin’s Fine and Rare 20-year-old.\n\nJames Martin & Co Ltd was acquired by Glenmorangie brand owner Macdonald & Muir Ltd in 1912, and today, with the French luxury goods firm Louis Vuitton-Moët Hennessy (LVMH) owning Glenmorangie, the company remains a non-trading subsidiary, with a registered address at Glenmorangie’s Edinburgh headquarters.\n\nAfter the purchase of Glenmorangie by LVMH in 2004, the James Martin brand of blended whiskies was discontinued.",,https://arweave.net/bYS2af2ZGGYGEjg5nRtKz2RW43yLjg1QI2s7DOCDr7o,"James Martin Fine & Rare 30 Years,James Martin Fine & Rare 20 Years"
Nikka Whisky,Nikka,"Recognized as the ""Father of Japanese whisky"", Nikka Whisky founder Masataka Taketsuru shaped the history of Japanese whisky, with the loving support of his Scottish wife Rita.\nMasataka Taketsuru, son of a sake brewing family, enters the Settsu Shuzo Company which has a plan to produce the first authentic Japanese whisky.\nWith a background in chemistry, the young man leaves for Scotland with the aim of discovering the secrets of whisky production.\nInitially operating under the name ""Dai Nippon Kaju"", meaning the ""great Japanese juice company"", the company name is officially changed to Nikka Whisky in 1952, a contraction of NI-ppon and KA-ju, though this name already appears on the label of the first whisky released in 1940.",,https://arweave.net/V-oXxdENaoxNQsBMRg3WmQ_zt_49zRMXsboqhTrJyKU,Nikka Miyagikyo Peated
Suntory Distillery,Suntory,"The founder of Kotobukiya (the current Suntory), Shinjiro Torii, began building Japan's first malt whiskey distillery on the outskirts of Kyoto in 1923. The Yamazaki district now known as the birthplace of Suntory whiskey, is an area also known since ancient times for its excellent water by the name of Minaseno.\nSuntory introduced Suntory Shirofuda (""white label"") in 1929, the first genuine whiskey to be produced domestically.\nAfter further refinements to suit the discriminating market of Japan, the premium whiskey Kakubin (""square bottle"") was born.\nAnother distillery was built in 1973 in Hakushu at the foot of Mt. Kaikomagatake in Japan's Southern Alps. Suntory refined its techniques at these two ideal distillery sites to develop a variety of first-rate unblended whiskies and bring to market such products as the single malt whiskies Yamazaki and Hakushu, as well as Hibiki blended whiskey.",,https://arweave.net/NEx7DinJyIb1Dtpsb2uuIuzUxvGTFKPIdl1Zel9axFk,
The Macallan,Macallan,"Founded in 1824, The Macallan was one of the first distillers in Scotland to be legally licensed. Since then we have built a reputation as one of the world's leading single malt whiskies. The creation of The Macallan draws on the vital contributing influences of Spain, North America and Scotland - and of their respective natural raw materials, combined with traditional methods and craftsmanship.\nThe Macallan distillery was founded by Alexander Reid, a barley farmer and school teacher.\nThe original name of the area was ""Maghellan"", taken from the Gaelic word ""magh"", meaning fertile ground and ""Ellan"", from the Monk St.Fillan - who held a close association with the church that stood in the grounds of The Macallan Estate until 1400.\nFarmers had been making whisky on their Speyside farms in the area for centuries, using their surplus barley during the quieter winter months.",,https://arweave.net/0dzm_sypT4AqY9d1cdfYXeuy2tv0txtlOvljE8OmWd4,The Macallan Double Cask 12 Years Old
Broken Bones Distillery,BrokenBones,"Broken Bones is a family owned craft distillery that grew out of family tradition of producing beer, wine and spirits. Broken Bones offers a variety of gins and whiskies. Our aim is to produce spirits of the highest quality, designed to convince and enchante the consumers with powerful, complex and surprisingly, yet dangerously smooth, taste profiles and aromas, carefully developed by our master distillers.\n\nEvery spirit is a combination of traditional recipes with a touch of Slovenia: our gins take their distinctive flavour from the botanicals, which we carefully select and handpick in the Slovene Karst region, while our whiskies age in Slovene oak barrels, where they get their special floral touch.\n\nThe exclusive design of our range underlines the project’s boldness and our drive for perfection.",,https://arweave.net/fEuvuwpTsXca5JBYEKUsdPK__pNwK1ox1Br5zU5UAZA,"Broken Bones Peated Whisky Cask Strength 6 Years (Outside EU),Broken Bones Peated Whisky Cask Strength 4 Years (Outside EU),Broken Bones Whisky Cask Strength 3 Years (Outside EU),Broken Bones Peated Whisky 5 Years (Outside EU),Broken Bones Whisky 3 Years (Outside EU),Broken Bones Whisky Cask (Outside EU),Broken Bones Whisky Cask Peated (Outside EU),Broken Bones Peated Whisky Cask Strength 6 Years (EU),Broken Bones Peated Whisky Cask Strength 4 Years (EU),Broken Bones Whisky Cask Strength 3 Years (EU),Broken Bones Peated Whisky 5 Years (EU),Broken Bones Whisky 3 Years (EU),Broken Bones Whisky Cask (EU),Broken Bones Whisky Cask Peated (EU)"
Sakurao Distillery,Togouchi,"The Sakurao Distillery was founded in 2017, near the Seto inland sea. It relies on more than a century of expertise gained by producing traditional Japanese spirits. Sakurao is now part of a very limited group of Japanese distilleries able to produce 100% Japanese whiskies as all the malt and grain whiskies used in their blends are distilled through its stills.\n\nThe art of distilling is thoughtfully cultivated at Sakurao Distillery.\nFor malt distillation, the swan neck of the pot still is purposedly modified to retain more esters and design more complex whiskies. A hybrid still is then used for the second distillation, which results in a higher alcohol volume than usual and fruitier whiskies.\nFor grain distillation, made out of barley, the traditional still that used to be operated for shochu production is used. A second distillation is then operated in a still designed by Sakurao, using the traditional iron still topped with a distillation column. This process leads to a light and floral whisky profile.\n\nThe casks are brought to their underground cellar in the small town of Akiota-Togouchi. This unusual setting makes it possible to control the environmental factors that are decisive in obtaining the desired aromatic profile. This slows down the extraction of aromas from the barrel and explains the elegant profile of the Togouchi range as well as its light colour.",,https://arweave.net/l40EZDSmGq4Qd31o5R41eKcWwm3hzsfBuooM39nzJ7Q,Togouchi Pure Malt
